{
  "format": 1,
  "id": "uebersichtlich-wie-fastmail",
  "name": "Übersichtlich (wie Fastmail)",
  "version": "1.0.0",
  "author": "fastmail-alternative",
  "license": "ISC",
  "minAppVersion": "0.1.0",
  "description": "Lesebereich rechts, kompakte Liste mit Vorschau aus, Kontoleiste mit Namen, ruhige Farben. Nur Anordnung und Dichte sind angelehnt; eigene Farben, keine Logos oder Markenelemente – keine Verbindung zu den genannten Marken.",
  "colors": {
    "light": {
      "base-200": "#f4f5f8",
      "base-300": "#e2e5ec",
      "primary": "#3a4fa0",
      "primary-content": "#ffffff"
    },
    "dark": {
      "base-100": "#171a20",
      "base-200": "#1f232b",
      "base-300": "#2b3039",
      "primary": "#a3b2ef",
      "primary-content": "#111a3a"
    }
  },
  "sizes": {
    "radius": "0.375rem",
    "text-md": "0.9rem"
  },
  "layout": {
    "readingPane": "right",
    "density": "compact",
    "accountRail": "list"
  }
}
